{
  "$schema": "https://json-schema.org/draft/2020-12/schema",
  "$id": "https://github.com/TanyaJha/AIPlayground/projects/fitcheck/resume/resume.schema.json",
  "title": "Résumé spec",
  "description": "The structured input to the fitcheck renderer (render.js). A projection of the achievement bank for one target: header + summary + experience (roles with bullets) + optional projects, skills, education. Inline **bold** is supported in any text field. Em dashes are forbidden and rejected at render time.",
  "type": "object",
  "additionalProperties": false,
  "required": ["name", "experience"],
  "properties": {
    "name": { "type": "string" },
    "contact": { "type": "string", "description": "Single line, middot-separated: 'City · email · phone · linkedin · github'." },
    "summary": { "type": "string", "description": "One bold-ish sentence. Supports **bold**." },
    "experienceHeading": { "type": "string", "default": "Experience" },
    "experience": {
      "type": "array",
      "minItems": 1,
      "items": {
        "type": "object",
        "additionalProperties": false,
        "required": ["org"],
        "properties": {
          "org": { "type": "string", "description": "e.g. 'Microsoft · Senior Product Manager, Active Directory · Redmond, WA'." },
          "dates": { "type": "string" },
          "subline": { "type": "string", "description": "Optional italic scope line under the role." },
          "bullets": { "type": "array", "items": { "type": "string" }, "description": "Each supports **bold**. Usually a chosen framing from a bank entry." }
        }
      }
    },
    "projects": { "type": "array", "items": { "type": "string" } },
    "skills": {
      "type": "array",
      "items": {
        "type": "object",
        "additionalProperties": false,
        "required": ["label", "text"],
        "properties": { "label": { "type": "string" }, "text": { "type": "string" } }
      }
    },
    "education": { "type": "array", "items": { "type": "string" } }
  }
}
